{
  "$schema": "https://json-schema.org/draft/2020-12/schema",
  "type": "object",
  "required": ["schema_version", "stage_id", "files"],
  "properties": {
    "schema_version": {"type": "string", "const": "v1"},
    "stage_id": {"type": "string", "pattern": "^CML[0-9]{2}[A-Z]?_[A-Z0-9_]+$"},
    "created_at": {"type": "string"},
    "files": {
      "type": "array",
      "minItems": 1,
      "items": {
        "type": "object",
        "required": ["path", "sha256"],
        "properties": {
          "path": {"type": "string", "minLength": 1},
          "sha256": {"type": "string", "minLength": 64, "maxLength": 64}
        },
        "additionalProperties": false
      }
    }
  },
  "additionalProperties": false
}
