{
  "created_at": "2026-07-02T00:00:00Z",
  "files": [
    {
      "path": "tools/cml15_lifecycle_runner.py",
      "sha256": "db44cd174134e046a090aaff2a243ae82c4576352566468fb8f29388a549763b"
    },
    {
      "path": "tools/capability_matrix_gate.py",
      "sha256": "7675cb5660285792ecbbe9cd1f1bf5a32cd9d34b3d5572294ac41615f01f90c0"
    }
  ],
  "schema_version": "v1",
  "stage_id": "CML15C_REBALANCE_SLOTS_30"
}
