{
  "schema_version": "v1",
  "stage_id": "CML13_FINAL_FULL_CHAIN_AUDIT_AND_PUSH",
  "created_at": "2026-07-02T08:22:41.449749Z",
  "files": [
    {
      "path": "codex/capability_matrix_loop/stage_manifest.json",
      "sha256": "df691eb4806e593b5c87146cf93386016181512c5a506de145da99dd8557573a"
    },
    {
      "path": "tools/capability_matrix_gate.py",
      "sha256": "d7c9b87d2cf1bafd5e344702b3dbd551cec5db3df4eb472f47c83b7e3e87089f"
    },
    {
      "path": "tests/capability_loop/test_capability_matrix_gate.py",
      "sha256": "e1b9bc60afc6147e5266a25e68382b2bd528e42171ddd49606c9749099440248"
    }
  ]
}
